{"report_version":"0","release":"core-generation-v0","release_sha256":"16122cca198d9e688d3c4b5724ac11f0324a4390d8e8589e443fe04a48e81391","implementation":{"name":"anyinfer-dotnet","version":"0.1.0-proof","source_revision":"7f3bc6931c5bb656b08cc9b3e5fed11478a1c0fa","driver_revision":"7f3bc6931c5bb656b08cc9b3e5fed11478a1c0fa","runtime":".NET 8.0.31","os":"Microsoft Windows 10.0.26200","dependencies":{"nuget:microsoft.codecoverage":"17.14.1","nuget:microsoft.net.test.sdk":"17.14.1","nuget:microsoft.testplatform.objectmodel":"17.14.1","nuget:microsoft.testplatform.testhost":"17.14.1","nuget:newtonsoft.json":"13.0.3","nuget:system.collections.immutable":"8.0.0","nuget:system.reflection.metadata":"8.0.0","nuget:xunit":"2.9.3","nuget:xunit.abstractions":"2.0.3","nuget:xunit.analyzers":"1.18.0","nuget:xunit.assert":"2.9.3","nuget:xunit.core":"2.9.3","nuget:xunit.extensibility.core":"2.9.3","nuget:xunit.extensibility.execution":"2.9.3","nuget:xunit.runner.visualstudio":"3.1.5"},"extensions":[]},"cases":[{"id":"driver/assessment-completeness","verdict":"pass","detail":null,"evidence":{"recipe_ref":"driver/assessment-completeness","observations":{"recipe_ref":"driver/assessment-completeness","no_candidate":{"outcome":{"kind":"error","error":{"type":"SchemaViolationException","category":"schema_violation","retryable":false,"phase":"validate","retry_after_s":null,"http_status":null,"provider":null,"detail":null,"hint":null,"issues":[{"rule":"no_json_candidate","instance_path":[],"schema_path":[],"parameters":{}}],"attempts":[]}},"available":true,"assessments":[{"assessment_id":"340caa6d-043c-464b-8c95-1954b32bb66c","operation_id":"13aa0395-8ad8-4b54-b76b-012b031448bf","source_entry_ordinal":1,"kind":"extraction","valid":false,"all_findings":[{"rule":"no_json_candidate","instance_path":[],"schema_path":[],"source":"response-extractor.scanner","native_facts":{"rule":"no_json_candidate"}}],"selected_findings":[{"rule":"no_json_candidate","instance_path":[],"schema_path":[],"source":"response-extractor.scanner","native_facts":{"rule":"no_json_candidate"}}]}],"repairs":[],"entries":[{"operation_id":"13aa0395-8ad8-4b54-b76b-012b031448bf","ordinal":1,"role":"original","timeout_s":120.0,"max_response_bytes":1048576}]},"late_malformed_required":{"outcome":{"kind":"error","error":{"type":"SchemaViolationException","category":"schema_violation","retryable":false,"phase":"validate","retry_after_s":null,"http_status":null,"provider":null,"detail":null,"hint":null,"issues":[{"rule":"invalid_schema","instance_path":[],"schema_path":["required"],"parameters":{}}],"attempts":[]}},"available":true,"assessments":[{"assessment_id":"990cbd8b-d131-4f93-aa46-957a3c4d9b78","operation_id":"bfcadd19-931e-429c-8e4e-0e848f90c201","source_entry_ordinal":1,"kind":"validation","valid":false,"all_findings":[{"rule":"invalid_schema","instance_path":[],"schema_path":["required"],"source":"schema-validator.meta","native_facts":{"rule":"invalid_schema","instance_path":null,"schema_path":["required"],"schema_value":17,"expected_form":"an array of unique strings"}}],"selected_findings":[{"rule":"invalid_schema","instance_path":[],"schema_path":["required"],"source":"schema-validator.meta","native_facts":{"rule":"invalid_schema","instance_path":null,"schema_path":["required"],"schema_value":17,"expected_form":"an array of unique strings"}}]}],"repairs":[],"entries":[{"operation_id":"bfcadd19-931e-429c-8e4e-0e848f90c201","ordinal":1,"role":"original","timeout_s":120.0,"max_response_bytes":1048576}]},"exhaustion":{"outcome":{"kind":"error","error":{"type":"SchemaViolationException","category":"schema_violation","retryable":false,"phase":"validate","retry_after_s":null,"http_status":null,"provider":null,"detail":null,"hint":null,"issues":[{"rule":"required","instance_path":[],"schema_path":["required"],"parameters":{"property":"age"}}],"attempts":[]}},"available":true,"assessments":[{"assessment_id":"4b919443-ffca-4f69-8d9f-47c031020522","operation_id":"b1ade7c6-252f-400d-ab36-cc4e97bf7c53","source_entry_ordinal":1,"kind":"validation","valid":false,"all_findings":[{"rule":"required","instance_path":[],"schema_path":["required"],"source":"schema-validator","native_facts":{"rule":"required","instance_path":[],"schema_path":["required"],"constraint":["age"],"instance":{}}}],"selected_findings":[{"rule":"required","instance_path":[],"schema_path":["required"],"source":"schema-validator","native_facts":{"rule":"required","instance_path":[],"schema_path":["required"],"constraint":["age"],"instance":{}}}]},{"assessment_id":"6191bfbc-5443-4071-a832-faf28714476b","operation_id":"b1ade7c6-252f-400d-ab36-cc4e97bf7c53","source_entry_ordinal":2,"kind":"validation","valid":false,"all_findings":[{"rule":"required","instance_path":[],"schema_path":["required"],"source":"schema-validator","native_facts":{"rule":"required","instance_path":[],"schema_path":["required"],"constraint":["age"],"instance":{}}}],"selected_findings":[{"rule":"required","instance_path":[],"schema_path":["required"],"source":"schema-validator","native_facts":{"rule":"required","instance_path":[],"schema_path":["required"],"constraint":["age"],"instance":{}}}]}],"repairs":[{"assessment_id":"4b919443-ffca-4f69-8d9f-47c031020522","response":"{}","message_count":3}],"entries":[{"operation_id":"b1ade7c6-252f-400d-ab36-cc4e97bf7c53","ordinal":1,"role":"original","timeout_s":120.0,"max_response_bytes":1048576},{"operation_id":"b1ade7c6-252f-400d-ab36-cc4e97bf7c53","ordinal":2,"role":"correction","timeout_s":120.0,"max_response_bytes":1048576}]},"nested_dotted":{"outcome":{"kind":"error","error":{"type":"SchemaViolationException","category":"schema_violation","retryable":false,"phase":"validate","retry_after_s":null,"http_status":null,"provider":null,"detail":null,"hint":null,"issues":[{"rule":"type","instance_path":["outer","value"],"schema_path":["properties","outer","properties","value","type"],"parameters":{"expected":"integer","actual":"string"}},{"rule":"type","instance_path":["a.b"],"schema_path":["properties","a.b","type"],"parameters":{"expected":"integer","actual":"string"}}],"attempts":[]}},"available":true,"assessments":[{"assessment_id":"461ad9fd-8645-43c7-b2ab-027b44e07e87","operation_id":"4857fd1c-382f-4ddc-87b5-e3e794ac5d23","source_entry_ordinal":1,"kind":"validation","valid":false,"all_findings":[{"rule":"type","instance_path":["outer","value"],"schema_path":["properties","outer","properties","value","type"],"source":"schema-validator","native_facts":{"rule":"type","instance_path":["outer","value"],"schema_path":["properties","outer","properties","value","type"],"constraint":"integer","instance":"wrong"}},{"rule":"type","instance_path":["a.b"],"schema_path":["properties","a.b","type"],"source":"schema-validator","native_facts":{"rule":"type","instance_path":["a.b"],"schema_path":["properties","a.b","type"],"constraint":"integer","instance":"wrong"}}],"selected_findings":[{"rule":"type","instance_path":["outer","value"],"schema_path":["properties","outer","properties","value","type"],"source":"schema-validator","native_facts":{"rule":"type","instance_path":["outer","value"],"schema_path":["properties","outer","properties","value","type"],"constraint":"integer","instance":"wrong"}},{"rule":"type","instance_path":["a.b"],"schema_path":["properties","a.b","type"],"source":"schema-validator","native_facts":{"rule":"type","instance_path":["a.b"],"schema_path":["properties","a.b","type"],"constraint":"integer","instance":"wrong"}}]}],"repairs":[],"entries":[{"operation_id":"4857fd1c-382f-4ddc-87b5-e3e794ac5d23","ordinal":1,"role":"original","timeout_s":120.0,"max_response_bytes":1048576}]},"invalid_then_valid":{"outcome":{"kind":"result","result":{"text":"{\"age\":7}","structured":{"age":7},"target":{"provider":"proof","model":"model"},"finish_reason":"stop","usage":{"input_tokens":null,"output_tokens":null,"total_tokens":null,"cache_read_tokens":null,"cache_write_tokens":null,"reasoning_tokens":null},"timing_presence":{"first_token":true,"total":true},"structured_mechanism":"prompt","repair_attempts":1,"attempts":[{"target":{"provider":"proof","model":"model"},"outcome":"ok","error":null}],"warnings":[]}},"available":true,"assessments":[{"assessment_id":"c25b3751-bea3-41b9-9d51-be26df8d3a5c","operation_id":"c9208a61-4c50-4cc3-9797-33fdb16c1451","source_entry_ordinal":1,"kind":"validation","valid":false,"all_findings":[{"rule":"required","instance_path":[],"schema_path":["required"],"source":"schema-validator","native_facts":{"rule":"required","instance_path":[],"schema_path":["required"],"constraint":["age"],"instance":{}}}],"selected_findings":[{"rule":"required","instance_path":[],"schema_path":["required"],"source":"schema-validator","native_facts":{"rule":"required","instance_path":[],"schema_path":["required"],"constraint":["age"],"instance":{}}}]},{"assessment_id":"82396e40-e73e-4eea-b00a-154914dcccd1","operation_id":"c9208a61-4c50-4cc3-9797-33fdb16c1451","source_entry_ordinal":2,"kind":"validation","valid":true,"all_findings":[],"selected_findings":[]}],"repairs":[{"assessment_id":"c25b3751-bea3-41b9-9d51-be26df8d3a5c","response":"{}","message_count":3}],"entries":[{"operation_id":"c9208a61-4c50-4cc3-9797-33fdb16c1451","ordinal":1,"role":"original","timeout_s":120.0,"max_response_bytes":1048576},{"operation_id":"c9208a61-4c50-4cc3-9797-33fdb16c1451","ordinal":2,"role":"correction","timeout_s":120.0,"max_response_bytes":1048576}]},"cap_control":{"normal_outcome":{"kind":"result","result":{"text":"{\"age\":7}","structured":{"age":7},"target":{"provider":"proof","model":"model"},"finish_reason":"stop","usage":{"input_tokens":null,"output_tokens":null,"total_tokens":null,"cache_read_tokens":null,"cache_write_tokens":null,"reasoning_tokens":null},"timing_presence":{"first_token":true,"total":true},"structured_mechanism":"prompt","repair_attempts":1,"attempts":[{"target":{"provider":"proof","model":"model"},"outcome":"ok","error":null}],"warnings":[]}},"unavailable_outcome":{"kind":"result","result":{"